[
  { "id": "ACT-1.2.1", "projectId": "PRJ-METRO-001", "snapshotId": "SNP-DEMO-001", "wbs": "1.2.1", "level": 6, "name": "Pier P12 reinforcement fixing", "discipline": "structural", "workType": "reinforcement", "assetId": "PIER-P12", "location": { "kind": "chainage", "alignment": "BL", "start": 12400, "end": 12430, "unit": "m" }, "plannedStart": "2026-09-24", "plannedFinish": "2026-09-28", "plannedQuantity": { "value": 20, "unit": "t" }, "actualProgressPercent": 30 },
  { "id": "ACT-1.2.2", "projectId": "PRJ-METRO-001", "snapshotId": "SNP-DEMO-001", "wbs": "1.2.2", "level": 6, "name": "Pier P12 formwork installation", "discipline": "structural", "workType": "formwork", "assetId": "PIER-P12", "location": { "kind": "chainage", "alignment": "BL", "start": 12400, "end": 12430, "unit": "m" }, "plannedStart": "2026-09-26", "plannedFinish": "2026-09-30", "actualProgressPercent": 10 },
  { "id": "ACT-2.1", "projectId": "PRJ-METRO-001", "snapshotId": "SNP-DEMO-001", "wbs": "2.1", "level": 5, "name": "Station electrical interface works", "discipline": "electrical", "workType": "cable-installation", "assetId": "STN-03", "location": { "kind": "chainage", "alignment": "BL", "start": 15800, "end": 16100, "unit": "m" }, "plannedStart": "2026-10-01", "plannedFinish": "2026-10-12", "actualProgressPercent": 0 }
]
